{
  "schema_version": "x-relay.agent-execution-trace.v1",
  "span_id": "0123456789abcdef",
  "trace_id": "0123456789abcdef0123456789abcdef",
  "parent_span_id": null,
  "span_type": "llm_call",
  "status": "ok",
  "started_at": "2026-05-15T12:00:00Z",
  "ended_at": "2026-05-15T12:00:01Z",
  "duration_ms": 1000,
  "error_class": null,
  "redacted_metadata_digest": "0000000000000000000000000000000000000000000000000000000000000000"
}
